Source_Post_Slug,Source_Post_Title,Target_Post_Slug,Target_Post_Title,Anchor_Text_Suggestion,Link_Type,Priority,Implementation_Phase,Rationale
2025-04-24-building-secure-homelab-adventure,Building Security-Focused Homelab,2024-01-18-demystifying-cryptography-beginners-guide,Demystifying Cryptography,see my guide to cryptography fundamentals,Hub→Hub,P0,Phase_1,Foundation for security concepts
2025-04-24-building-secure-homelab-adventure,Building Security-Focused Homelab,2025-09-08-zero-trust-vlan-segmentation-homelab,Zero Trust Microsegmentation,implementing zero trust microsegmentation with VLANs,Hub→Hub,P0,Phase_1,Network architecture component
2025-04-24-building-secure-homelab-adventure,Building Security-Focused Homelab,2025-08-25-network-traffic-analysis-suricata-homelab,Network Traffic Analysis Suricata,building a network traffic analysis lab with Suricata,Hub→Spoke,P0,Phase_1,IDS/IPS implementation
2025-04-24-building-secure-homelab-adventure,Building Security-Focused Homelab,2025-09-20-iot-security-homelab-owasp,IoT Security OWASP,lessons from OWASP IoTGoat on IoT security,Hub→Spoke,P0,Phase_1,IoT security component
2025-04-24-building-secure-homelab-adventure,Building Security-Focused Homelab,2025-03-10-raspberry-pi-security-projects,Raspberry Pi Security Projects,Raspberry Pi security projects that solve real problems,Hub→Spoke,P1,Phase_1,Affordable lab hardware
2025-04-24-building-secure-homelab-adventure,Building Security-Focused Homelab,2025-07-08-implementing-dns-over-https-home-networks,DNS-over-HTTPS Implementation,implementing DNS-over-HTTPS for encrypted queries,Hub→Spoke,P1,Phase_1,Privacy/security measure
2025-04-24-building-secure-homelab-adventure,Building Security-Focused Homelab,2025-10-06-automated-security-scanning-pipeline,Automated Security Scanning,automated security scanning pipeline with Grype,Hub→Spoke,P1,Phase_1,Vulnerability management
2025-04-24-building-secure-homelab-adventure,Building Security-Focused Homelab,2025-08-18-container-security-hardening-homelab,Container Security Hardening,container security hardening guide,Hub→Spoke,P1,Phase_1,Virtualization security
2024-01-18-demystifying-cryptography-beginners-guide,Demystifying Cryptography,2025-10-29-post-quantum-cryptography-homelab,Post-Quantum Cryptography Homelab,preparing your homelab for the quantum future,Hub→Hub,P0,Phase_1,Advanced crypto topic
2024-01-18-demystifying-cryptography-beginners-guide,Demystifying Cryptography,2024-04-30-quantum-resistant-cryptography-guide,Quantum-Resistant Cryptography Guide,guide to quantum-resistant cryptography,Hub→Spoke,P0,Phase_1,Specific crypto application
2024-01-18-demystifying-cryptography-beginners-guide,Demystifying Cryptography,2024-01-08-writing-secure-code-developers-guide,Writing Secure Code,writing secure code that implements proper cryptography,Hub→Hub,P1,Phase_1,Application of crypto
2024-01-18-demystifying-cryptography-beginners-guide,Demystifying Cryptography,2024-07-09-zero-trust-architecture-implementation,Zero Trust Architecture,zero trust architecture relies on strong cryptography,Hub→Spoke,P1,Phase_1,Security framework
2024-01-18-demystifying-cryptography-beginners-guide,Demystifying Cryptography,2025-09-01-self-hosted-bitwarden-migration-guide,Self-Hosted Bitwarden,self-hosted password manager with end-to-end encryption,Hub→Spoke,P2,Phase_1,Practical crypto use
2024-01-18-demystifying-cryptography-beginners-guide,Demystifying Cryptography,2024-01-30-securing-cloud-native-frontier,Securing Cloud-Native Frontier,securing cloud-native applications with encryption,Hub→Spoke,P2,Phase_1,Cloud security
2025-06-25-local-llm-deployment-privacy-first,Local LLM Deployment,2025-10-29-privacy-first-ai-lab-local-llms,Privacy-First AI Lab,building a privacy-first AI lab,Hub→Hub,P0,Phase_1,Maintain existing link
2025-06-25-local-llm-deployment-privacy-first,Local LLM Deployment,2025-05-10-llm-fine-tuning-homelab-guide,Fine-Tuning LLMs Homelab,fine-tuning LLMs in your homelab,Hub→Hub,P0,Phase_1,Maintain existing link
2025-10-29-privacy-first-ai-lab-local-llms,Privacy-First AI Lab,2025-06-25-local-llm-deployment-privacy-first,Local LLM Deployment,deploying local LLMs with privacy-first approach,Hub→Hub,P0,Phase_1,Related implementation
2025-10-29-privacy-first-ai-lab-local-llms,Privacy-First AI Lab,2025-04-10-securing-personal-ai-experiments,Securing Personal AI Experiments,securing personal AI/ML experiments,Hub→Bridge,P0,Phase_1,Security foundation
2025-10-29-privacy-first-ai-lab-local-llms,Privacy-First AI Lab,2025-01-12-privacy-preserving-federated-learning-homelab,Privacy-Preserving Federated Learning,privacy-preserving federated learning across homelabs,Hub→Spoke,P0,Phase_1,Advanced privacy technique
2025-10-29-privacy-first-ai-lab-local-llms,Privacy-First AI Lab,2025-05-10-llm-fine-tuning-homelab-guide,Fine-Tuning LLMs Homelab,fine-tuning LLMs in your homelab,Hub→Hub,P1,Phase_1,Advanced usage
2025-10-29-privacy-first-ai-lab-local-llms,Privacy-First AI Lab,2025-04-24-building-secure-homelab-adventure,Building Security-Focused Homelab,building a security-focused homelab,Hub→Hub,P1,Phase_1,Infrastructure foundation
2025-10-29-privacy-first-ai-lab-local-llms,Privacy-First AI Lab,2024-11-15-gpu-power-monitoring-homelab-ml,GPU Power Monitoring,GPU power monitoring for ML workloads,Hub→Spoke,P2,Phase_1,Hardware considerations
2025-05-10-llm-fine-tuning-homelab-guide,Fine-Tuning LLMs Homelab,2025-06-25-local-llm-deployment-privacy-first,Local LLM Deployment,local LLM deployment guide,Hub→Hub,P0,Phase_1,Prerequisites
2025-05-10-llm-fine-tuning-homelab-guide,Fine-Tuning LLMs Homelab,2025-10-29-privacy-first-ai-lab-local-llms,Privacy-First AI Lab,privacy-first AI lab setup,Hub→Hub,P0,Phase_1,Security context
2025-05-10-llm-fine-tuning-homelab-guide,Fine-Tuning LLMs Homelab,2025-01-22-llm-agent-homelab-incident-response,LLM Agent Incident Response,LLM agents for incident response,Hub→Bridge,P1,Phase_1,Advanced application
2025-05-10-llm-fine-tuning-homelab-guide,Fine-Tuning LLMs Homelab,2024-04-04-retrieval-augmented-generation-rag,RAG Implementation,retrieval augmented generation (RAG),Hub→Spoke,P1,Phase_1,Related technique
2025-05-10-llm-fine-tuning-homelab-guide,Fine-Tuning LLMs Homelab,2024-11-15-gpu-power-monitoring-homelab-ml,GPU Power Monitoring,GPU power monitoring considerations,Hub→Spoke,P2,Phase_1,Hardware requirements
2025-05-10-llm-fine-tuning-homelab-guide,Fine-Tuning LLMs Homelab,2025-04-24-building-secure-homelab-adventure,Building Security-Focused Homelab,homelab infrastructure setup,Hub→Hub,P2,Phase_1,Foundation
2025-10-06-automated-security-scanning-pipeline,Automated Security Scanning,2025-09-20-vulnerability-prioritization-epss-kev,EPSS/KEV Vulnerability Prioritization,smart vulnerability prioritization with EPSS and KEV,Hub→Bridge,P0,Phase_1,Related automation
2025-10-06-automated-security-scanning-pipeline,Automated Security Scanning,2025-07-15-vulnerability-management-scale-open-source,Vulnerability Management Open Source,open-source vulnerability management at scale,Hub→Spoke,P0,Phase_1,Related tooling
2025-10-06-automated-security-scanning-pipeline,Automated Security Scanning,2025-08-18-container-security-hardening-homelab,Container Security Hardening,container security hardening practices,Hub→Bridge,P1,Phase_1,Related security
2025-10-06-automated-security-scanning-pipeline,Automated Security Scanning,2024-09-25-gvisor-container-sandboxing-security,gVisor Container Sandboxing,sandboxing untrusted containers with gVisor,Hub→Bridge,P1,Phase_1,Advanced container security
2025-10-06-automated-security-scanning-pipeline,Automated Security Scanning,2024-01-08-writing-secure-code-developers-guide,Writing Secure Code,writing secure code practices,Hub→Hub,P1,Phase_1,Development foundation
2025-10-06-automated-security-scanning-pipeline,Automated Security Scanning,2025-04-24-building-secure-homelab-adventure,Building Security-Focused Homelab,security-focused homelab setup,Hub→Hub,P2,Phase_1,Infrastructure
2025-09-08-zero-trust-vlan-segmentation-homelab,Zero Trust Microsegmentation,2024-07-09-zero-trust-architecture-implementation,Zero Trust Architecture,zero trust architecture fundamentals,Hub→Hub,P0,Phase_1,Conceptual foundation
2025-09-08-zero-trust-vlan-segmentation-homelab,Zero Trust Microsegmentation,2025-04-24-building-secure-homelab-adventure,Building Security-Focused Homelab,building a security-focused homelab with VLANs,Hub→Hub,P0,Phase_1,Implementation guide
2025-09-08-zero-trust-vlan-segmentation-homelab,Zero Trust Microsegmentation,2025-09-20-iot-security-homelab-owasp,IoT Security OWASP,IoT security with VLAN isolation,Hub→Bridge,P0,Phase_1,Specific use case
2025-09-08-zero-trust-vlan-segmentation-homelab,Zero Trust Microsegmentation,2025-07-08-implementing-dns-over-https-home-networks,DNS-over-HTTPS Implementation,DNS-over-HTTPS for encrypted queries,Hub→Spoke,P1,Phase_1,Privacy measure
2025-09-08-zero-trust-vlan-segmentation-homelab,Zero Trust Microsegmentation,2025-08-25-network-traffic-analysis-suricata-homelab,Network Traffic Analysis Suricata,network traffic analysis with Suricata,Hub→Spoke,P1,Phase_1,Monitoring component
2025-09-08-zero-trust-vlan-segmentation-homelab,Zero Trust Microsegmentation,2025-03-10-raspberry-pi-security-projects,Raspberry Pi Security Projects,Raspberry Pi network security projects,Hub→Spoke,P2,Phase_1,Affordable implementation
2025-10-29-post-quantum-cryptography-homelab,Post-Quantum Cryptography Homelab,2024-01-18-demystifying-cryptography-beginners-guide,Demystifying Cryptography,cryptography fundamentals guide,Hub→Hub,P0,Phase_1,Foundation
2025-10-29-post-quantum-cryptography-homelab,Post-Quantum Cryptography Homelab,2024-04-30-quantum-resistant-cryptography-guide,Quantum-Resistant Cryptography Guide,quantum-resistant cryptography guide,Hub→Spoke,P0,Phase_1,Related concept
2025-10-29-post-quantum-cryptography-homelab,Post-Quantum Cryptography Homelab,2024-08-02-quantum-computing-leap-forward,Quantum Computing Leap Forward,quantum computing's leap forward,Hub→Spoke,P0,Phase_1,Technology context
2025-10-29-post-quantum-cryptography-homelab,Post-Quantum Cryptography Homelab,2024-10-03-quantum-computing-defense,Quantum Computing Defense,quantum computing and defense implications,Hub→Spoke,P1,Phase_1,Security implications
2025-10-29-post-quantum-cryptography-homelab,Post-Quantum Cryptography Homelab,2025-04-24-building-secure-homelab-adventure,Building Security-Focused Homelab,security-focused homelab setup,Hub→Hub,P1,Phase_1,Implementation infrastructure
2025-10-29-post-quantum-cryptography-homelab,Post-Quantum Cryptography Homelab,2024-07-09-zero-trust-architecture-implementation,Zero Trust Architecture,zero trust architecture with PQC,Hub→Spoke,P2,Phase_1,Security framework
2025-09-29-proxmox-high-availability-homelab,Proxmox High Availability,2025-04-24-building-secure-homelab-adventure,Building Security-Focused Homelab,building a security-focused homelab,Hub→Hub,P0,Phase_1,Foundation
2025-09-29-proxmox-high-availability-homelab,Proxmox High Availability,2024-11-15-gpu-power-monitoring-homelab-ml,GPU Power Monitoring,GPU power monitoring in virtualized environments,Hub→Spoke,P1,Phase_1,Resource management
2025-09-29-proxmox-high-availability-homelab,Proxmox High Availability,2025-03-10-raspberry-pi-security-projects,Raspberry Pi Security Projects,Raspberry Pi for affordable HA components,Hub→Spoke,P2,Phase_1,Alternative approach
2025-09-29-proxmox-high-availability-homelab,Proxmox High Availability,2024-06-25-designing-resilient-systems,Designing Resilient Systems,designing resilient systems principles,Hub→Spoke,P1,Phase_1,Architectural concepts
2025-07-29-building-mcp-standards-server,Building MCP Standards Server,2025-10-17-progressive-context-loading-llm-workflows,Progressive Context Loading,progressive context loading for LLM workflows,Hub→Spoke,P0,Phase_1,Related tooling
2025-07-29-building-mcp-standards-server,Building MCP Standards Server,2025-08-07-supercharging-development-claude-flow,Supercharging Claude-Flow,supercharging development with Claude-Flow,Hub→Hub,P0,Phase_1,Related workflow
2025-07-29-building-mcp-standards-server,Building MCP Standards Server,2025-07-22-supercharging-claude-cli-with-standards,Supercharging Claude CLI Standards,supercharging Claude CLI with standards,Hub→Spoke,P0,Phase_1,Related tool
2025-07-29-building-mcp-standards-server,Building MCP Standards Server,2025-08-09-ai-cognitive-infrastructure,AI Cognitive Infrastructure,AI cognitive infrastructure concepts,Hub→Spoke,P1,Phase_1,Related architecture
2025-08-07-supercharging-development-claude-flow,Supercharging Claude-Flow,2025-07-29-building-mcp-standards-server,Building MCP Standards Server,building an MCP standards server,Hub→Hub,P0,Phase_1,Related tool
2025-08-07-supercharging-development-claude-flow,Supercharging Claude-Flow,2025-07-22-supercharging-claude-cli-with-standards,Supercharging Claude CLI Standards,supercharging Claude CLI,Hub→Spoke,P0,Phase_1,Related CLI tool
2025-08-07-supercharging-development-claude-flow,Supercharging Claude-Flow,2025-10-17-progressive-context-loading-llm-workflows,Progressive Context Loading,progressive context loading techniques,Hub→Spoke,P0,Phase_1,Related optimization
2025-08-07-supercharging-development-claude-flow,Supercharging Claude-Flow,2025-08-09-ai-cognitive-infrastructure,AI Cognitive Infrastructure,AI cognitive infrastructure design,Hub→Spoke,P1,Phase_1,Architectural concepts
2024-05-14-ai-new-frontier-cybersecurity,AI: New Frontier Cybersecurity,2025-04-10-securing-personal-ai-experiments,Securing Personal AI Experiments,securing personal AI/ML experiments,Hub→Bridge,P0,Phase_1,Security practices
2024-05-14-ai-new-frontier-cybersecurity,AI: New Frontier Cybersecurity,2025-01-22-llm-agent-homelab-incident-response,LLM Agent Incident Response,LLM agents for incident response,Hub→Bridge,P0,Phase_1,Defensive AI application
2024-05-14-ai-new-frontier-cybersecurity,AI: New Frontier Cybersecurity,2025-10-29-privacy-first-ai-lab-local-llms,Privacy-First AI Lab,privacy-first AI lab setup,Hub→Hub,P0,Phase_1,Privacy foundation
2024-05-14-ai-new-frontier-cybersecurity,AI: New Frontier Cybersecurity,2025-04-24-building-secure-homelab-adventure,Building Security-Focused Homelab,security-focused homelab for AI testing,Hub→Hub,P1,Phase_1,Infrastructure
2024-05-14-ai-new-frontier-cybersecurity,AI: New Frontier Cybersecurity,2025-09-14-threat-intelligence-mitre-attack-dashboard,MITRE ATT&CK Dashboard,MITRE ATT&CK threat intelligence dashboard,Hub→Spoke,P1,Phase_1,Threat intelligence
2024-05-14-ai-new-frontier-cybersecurity,AI: New Frontier Cybersecurity,2025-08-25-network-traffic-analysis-suricata-homelab,Network Traffic Analysis Suricata,network traffic analysis for AI threats,Hub→Spoke,P2,Phase_1,Monitoring
2024-01-08-writing-secure-code-developers-guide,Writing Secure Code,2024-01-18-demystifying-cryptography-beginners-guide,Demystifying Cryptography,cryptography fundamentals for developers,Hub→Hub,P0,Phase_1,Security foundation
2024-01-08-writing-secure-code-developers-guide,Writing Secure Code,2025-08-18-container-security-hardening-homelab,Container Security Hardening,container security hardening practices,Hub→Bridge,P0,Phase_1,Related security
2024-01-08-writing-secure-code-developers-guide,Writing Secure Code,2025-10-06-automated-security-scanning-pipeline,Automated Security Scanning,automated security scanning in CI/CD,Hub→Hub,P1,Phase_1,Development workflow
2024-01-08-writing-secure-code-developers-guide,Writing Secure Code,2025-07-15-vulnerability-management-scale-open-source,Vulnerability Management Open Source,open-source vulnerability management,Hub→Spoke,P1,Phase_1,Related tooling
2024-01-08-writing-secure-code-developers-guide,Writing Secure Code,2024-01-30-securing-cloud-native-frontier,Securing Cloud-Native Frontier,securing cloud-native applications,Hub→Spoke,P1,Phase_1,Deployment security
2024-07-09-zero-trust-architecture-implementation,Zero Trust Architecture,2025-09-08-zero-trust-vlan-segmentation-homelab,Zero Trust Microsegmentation,implementing zero trust microsegmentation,Hub→Hub,P0,Phase_1,Practical implementation
2024-07-09-zero-trust-architecture-implementation,Zero Trust Architecture,2025-04-24-building-secure-homelab-adventure,Building Security-Focused Homelab,security-focused homelab with zero trust,Hub→Hub,P0,Phase_1,Implementation guide
2024-07-09-zero-trust-architecture-implementation,Zero Trust Architecture,2024-01-30-securing-cloud-native-frontier,Securing Cloud-Native Frontier,zero trust for cloud-native apps,Hub→Spoke,P1,Phase_1,Cloud application
2024-07-09-zero-trust-architecture-implementation,Zero Trust Architecture,2024-01-18-demystifying-cryptography-beginners-guide,Demystifying Cryptography,cryptography in zero trust,Hub→Hub,P2,Phase_1,Security foundation
2025-08-25-network-traffic-analysis-suricata-homelab,Network Traffic Analysis Suricata,2025-04-24-building-secure-homelab-adventure,Building Security-Focused Homelab,building a security-focused homelab,Hub→Hub,P0,Phase_1,Infrastructure foundation
2025-08-25-network-traffic-analysis-suricata-homelab,Network Traffic Analysis Suricata,2025-09-20-iot-security-homelab-owasp,IoT Security OWASP,IoT security monitoring,Hub→Bridge,P0,Phase_1,Use case
2025-08-25-network-traffic-analysis-suricata-homelab,Network Traffic Analysis Suricata,2025-07-08-implementing-dns-over-https-home-networks,DNS-over-HTTPS Implementation,DNS-over-HTTPS encrypted traffic,Hub→Spoke,P1,Phase_1,Network privacy
2025-08-25-network-traffic-analysis-suricata-homelab,Network Traffic Analysis Suricata,2025-09-14-threat-intelligence-mitre-attack-dashboard,MITRE ATT&CK Dashboard,MITRE ATT&CK threat intelligence,Hub→Spoke,P1,Phase_1,Threat detection
2025-08-25-network-traffic-analysis-suricata-homelab,Network Traffic Analysis Suricata,2025-02-10-automating-home-network-security,Automating Home Network Security,automating network security monitoring,Hub→Bridge,P1,Phase_1,Automation
2025-09-20-iot-security-homelab-owasp,IoT Security OWASP,2025-09-08-zero-trust-vlan-segmentation-homelab,Zero Trust Microsegmentation,zero trust microsegmentation for IoT,Bridge→Hub,P0,Phase_2,Network isolation
2025-09-20-iot-security-homelab-owasp,IoT Security OWASP,2025-03-10-raspberry-pi-security-projects,Raspberry Pi Security Projects,Raspberry Pi security projects,Bridge→Spoke,P1,Phase_2,Related hardware
2025-09-20-iot-security-homelab-owasp,IoT Security OWASP,2025-08-18-container-security-hardening-homelab,Container Security Hardening,containerizing IoT services securely,Bridge→Bridge,P2,Phase_2,Related security
2025-04-10-securing-personal-ai-experiments,Securing Personal AI Experiments,2025-10-29-privacy-first-ai-lab-local-llms,Privacy-First AI Lab,privacy-first AI lab guide,Bridge→Hub,P0,Phase_2,Related setup
2025-04-10-securing-personal-ai-experiments,Securing Personal AI Experiments,2025-06-25-local-llm-deployment-privacy-first,Local LLM Deployment,deploying local LLMs securely,Bridge→Hub,P0,Phase_2,Implementation
2025-04-10-securing-personal-ai-experiments,Securing Personal AI Experiments,2025-04-24-building-secure-homelab-adventure,Building Security-Focused Homelab,security-focused homelab infrastructure,Bridge→Hub,P0,Phase_2,Foundation
2025-04-10-securing-personal-ai-experiments,Securing Personal AI Experiments,2024-05-14-ai-new-frontier-cybersecurity,AI: New Frontier Cybersecurity,AI in cybersecurity landscape,Bridge→Hub,P1,Phase_2,Threat context
2025-04-10-securing-personal-ai-experiments,Securing Personal AI Experiments,2024-01-18-demystifying-cryptography-beginners-guide,Demystifying Cryptography,cryptography for AI data protection,Bridge→Hub,P2,Phase_2,Security foundation
2025-01-22-llm-agent-homelab-incident-response,LLM Agent Incident Response,2025-06-25-local-llm-deployment-privacy-first,Local LLM Deployment,local LLM deployment for incident response,Bridge→Hub,P0,Phase_2,Implementation foundation
2025-01-22-llm-agent-homelab-incident-response,LLM Agent Incident Response,2025-10-29-privacy-first-ai-lab-local-llms,Privacy-First AI Lab,privacy-first AI lab setup,Bridge→Hub,P0,Phase_2,Security context
2025-01-22-llm-agent-homelab-incident-response,LLM Agent Incident Response,2025-05-10-llm-fine-tuning-homelab-guide,Fine-Tuning LLMs Homelab,fine-tuning LLMs for security tasks,Bridge→Hub,P1,Phase_2,Advanced usage
2025-01-22-llm-agent-homelab-incident-response,LLM Agent Incident Response,2024-05-14-ai-new-frontier-cybersecurity,AI: New Frontier Cybersecurity,AI in cybersecurity,Bridge→Hub,P1,Phase_2,Related concepts
2025-01-22-llm-agent-homelab-incident-response,LLM Agent Incident Response,2025-04-24-building-secure-homelab-adventure,Building Security-Focused Homelab,security-focused homelab infrastructure,Bridge→Hub,P2,Phase_2,Infrastructure
2025-01-22-llm-agent-homelab-incident-response,LLM Agent Incident Response,2025-09-14-threat-intelligence-mitre-attack-dashboard,MITRE ATT&CK Dashboard,MITRE ATT&CK threat intelligence,Bridge→Spoke,P2,Phase_2,Threat framework
2025-08-18-container-security-hardening-homelab,Container Security Hardening,2024-09-25-gvisor-container-sandboxing-security,gVisor Container Sandboxing,sandboxing untrusted containers with gVisor,Bridge→Bridge,P0,Phase_2,Related technique
2025-08-18-container-security-hardening-homelab,Container Security Hardening,2025-10-06-automated-security-scanning-pipeline,Automated Security Scanning,automated security scanning pipeline,Bridge→Hub,P0,Phase_2,CI/CD security
2025-08-18-container-security-hardening-homelab,Container Security Hardening,2024-01-30-securing-cloud-native-frontier,Securing Cloud-Native Frontier,securing cloud-native applications,Bridge→Spoke,P0,Phase_2,Deployment context
2025-08-18-container-security-hardening-homelab,Container Security Hardening,2024-01-08-writing-secure-code-developers-guide,Writing Secure Code,writing secure code practices,Bridge→Hub,P1,Phase_2,Development foundation
2025-08-18-container-security-hardening-homelab,Container Security Hardening,2025-04-24-building-secure-homelab-adventure,Building Security-Focused Homelab,homelab container security,Bridge→Hub,P1,Phase_2,Lab implementation
2025-08-18-container-security-hardening-homelab,Container Security Hardening,2024-07-09-zero-trust-architecture-implementation,Zero Trust Architecture,zero trust for containers,Bridge→Spoke,P2,Phase_2,Security framework
2024-09-25-gvisor-container-sandboxing-security,gVisor Container Sandboxing,2025-08-18-container-security-hardening-homelab,Container Security Hardening,container security hardening guide,Bridge→Bridge,P0,Phase_2,Related security
2024-09-25-gvisor-container-sandboxing-security,gVisor Container Sandboxing,2024-01-30-securing-cloud-native-frontier,Securing Cloud-Native Frontier,securing cloud-native deployments,Bridge→Spoke,P0,Phase_2,Deployment context
2024-09-25-gvisor-container-sandboxing-security,gVisor Container Sandboxing,2025-10-06-automated-security-scanning-pipeline,Automated Security Scanning,automated security scanning for containers,Bridge→Hub,P1,Phase_2,Security validation
2024-09-25-gvisor-container-sandboxing-security,gVisor Container Sandboxing,2024-01-08-writing-secure-code-developers-guide,Writing Secure Code,secure coding practices,Bridge→Hub,P2,Phase_2,Development foundation
2024-11-15-gpu-power-monitoring-homelab-ml,GPU Power Monitoring,2025-06-25-local-llm-deployment-privacy-first,Local LLM Deployment,local LLM deployment resource requirements,Bridge→Hub,P0,Phase_2,Related usage
2024-11-15-gpu-power-monitoring-homelab-ml,GPU Power Monitoring,2025-05-10-llm-fine-tuning-homelab-guide,Fine-Tuning LLMs Homelab,fine-tuning LLMs power consumption,Bridge→Hub,P0,Phase_2,Resource planning
2024-11-15-gpu-power-monitoring-homelab-ml,GPU Power Monitoring,2025-10-29-privacy-first-ai-lab-local-llms,Privacy-First AI Lab,privacy-first AI lab infrastructure,Bridge→Hub,P1,Phase_2,Lab setup
2024-11-15-gpu-power-monitoring-homelab-ml,GPU Power Monitoring,2025-04-24-building-secure-homelab-adventure,Building Security-Focused Homelab,homelab infrastructure planning,Bridge→Hub,P1,Phase_2,Foundation
2024-11-15-gpu-power-monitoring-homelab-ml,GPU Power Monitoring,2025-09-29-proxmox-high-availability-homelab,Proxmox High Availability,Proxmox HA with GPU passthrough,Bridge→Hub,P2,Phase_2,Virtualization
2024-11-15-gpu-power-monitoring-homelab-ml,GPU Power Monitoring,2024-07-16-sustainable-computing-carbon-footprint,Sustainable Computing,sustainable computing practices,Bridge→Spoke,P1,Phase_2,Related concern
2025-03-10-raspberry-pi-security-projects,Raspberry Pi Security Projects,2025-04-24-building-secure-homelab-adventure,Building Security-Focused Homelab,security-focused homelab guide,Bridge→Hub,P0,Phase_2,Foundation
2025-03-10-raspberry-pi-security-projects,Raspberry Pi Security Projects,2025-02-10-automating-home-network-security,Automating Home Network Security,automating network security with Pi,Bridge→Bridge,P0,Phase_2,Related automation
2025-03-10-raspberry-pi-security-projects,Raspberry Pi Security Projects,2025-09-20-iot-security-homelab-owasp,IoT Security OWASP,IoT security testing,Bridge→Bridge,P0,Phase_2,Related security
2025-03-10-raspberry-pi-security-projects,Raspberry Pi Security Projects,2025-07-08-implementing-dns-over-https-home-networks,DNS-over-HTTPS Implementation,DNS-over-HTTPS on Pi,Bridge→Spoke,P1,Phase_2,Related project
2025-03-10-raspberry-pi-security-projects,Raspberry Pi Security Projects,2024-09-15-running-llama-raspberry-pi-pipeload,Running LLaMA on Pi,running LLaMA 3.1 on Raspberry Pi,Bridge→Spoke,P1,Phase_2,Related project
